,New Code,OPs
0,OP9,"Definition of business glossary management processes | Definition of processes to manage the usage of the organization's business glossary. This includes processes to add, modify or remove business terms from the business glossary along with the different roles & responsibilities involved in processes. As a best practice, business glossary management processes should reflect the capabilities integrated within the organization's chosen business glossary tool (eg., Collibra, Informatica, Alation)"
1,OP1,Definition of guidelines and procedures for the management of the business glossary | 
2,OP2,Definition of guidelines and procedures for the corporate usage of the business glossary | 
3,OP3,Periodic assessment of the corporate alignment on the business glossary | 
4,OP4,"Definition of role structure for the management of the business glossary | Definition of a formal role structure for the management of the business glossary. This includes the roles and responsibilities for the addition, modification and removal of business terms as well as the roles responsible for providing, modifying or removing access permissions for the use of the business glossary. "
5,OP5,"Management of a corporate list of business glossary stakeholders | Management of a corporate list of stakeholders involved with the business glossary stakeholders. This list must include stakeholder roles and responsibilities as well as their access permissions (eg., read, write, modify, approve, etc.). The stakeholder list should be automatically updated when changes are made to access permissions and when new stakeholders are provided access to the business glossary. "
6,OP6,"Assignment of business glossary roles | Assignment of business glossary roles and responsibilities to stakeholders with relevant experience and data governance knowledge to properly execute the assigned responsibilities. When assigning roles, it is crucial to clearly lay out the responsibilities associated with each role and the required collaboration between roles to ensure the successful implementation and usage of the business glossary. "
7,OP74,Definition of data owner responsibilities | 
8,OP75,Designation of business data element owner | 
9,OP2375,Creation of a Data RACI for the project | Definition of the roles and responsibilities related to all the data user by the project
10,OP2376,Review and approval of the Data RACI for the project | Definition of the roles and responsibilities related to all the data user by the project
11,OP1892,Attestation of ownership for all AI data elements  | Establishing the ability to formally certify the ownership for all AI data elements  
12,OP7,"Establishment of a business glossary | Establishment of a business glossary to support proper metadata management and to standardize business terms throughout the organization. Establishing a business glossary should be done through the acquisition of one of many business glossary tools currently available on the market (eg., Collibra, Informatica, Alation, etc.). It is important to select the tool best fitted for the organization's context (eg., data volume, type / sensitivity of data, structured / unstructured data, data classification, etc.)"
13,OP1739,Integration of workflows in business glossary | 
14,OP1736,Creation of roadmap for new business data elements | Creation of a roadmap to illustrate how new business data elements are integrated in the business glossary. This roadmap must demonstrate the different approvals that must be obtained prior to adding a new business term to the business glossary. This roadmap should be communicated to relevant business glossary stakeholders.
15,OP2377,"Creation of a list of the business terms used ""In the lab"" and ""In the field"" | Creation of a list of all business terms used by the project, ased on the data requirements for data used ""In the lab"" and ""In the field"""
16,OP2378,Review and validation of business terms related to a project | Validation of the list of business terms used by a project
17,OP1718,Establishment of guidelines for business data element names and definitions  | Establishment of guidelines for the naming and definitions of business data elements to ensure that standardized business terms and definitions are achieved within the business glossary. These guidelines must set out best practices for the naming and definition of business terms such as ensuring that all names are unique and that abreviations / acronyms are not used in definitions.
18,OP1715,"Identification of key business data elements | Identification of key business data elements is crucial for the successful implementation of a business glossary. The criteria for identifying key business data elements should be based on the importance of the data element to the organization such as data used for financial or regulatory reporting, data introduced by or presented to company executives and data elements used in high-profile projects. "
19,OP10,Request for the creation of new business term (in the business glossary) | 
20,OP11,Request for the definition and approval of business terms | Capability to manage business term definition lifecycle 
21,OP12,Revision of new business term requests | 
22,OP13,"Approval for addition of new business terms to the business glossary | Establishment of a capability to ensure that the terms, definitions and relationships between data have been verified and approved by business stakeholders and stored as metadata."
23,OP1956,"Documentation of business term definitions | Documentation of business definitions shall be aligned with the pre-defined business term naming and definition guidelines. Business term definitions sould be concise and as short as possible without losing the meaning of the business term. The definition should express what the business term is, not what it does, so the definition for a term should start with a noun. "
24,OP14,"Approval of business definitions for data | Establishment of a capability to ensure that the terms, definitions and relationships between data have been verified and approved by business stakeholders and stored as metadata."
25,OP2069,Mapping of business definitions to taxonomies | Mapping business definitions to pre-defined taxonomies allows the establishment of relationships between business terms to show how they relate to one each other. Mapping to taxonomies also makes it easier for users to search for terms and provides a link for business terms between technical and business entities.
26,OP15,Definition of guidelines to avoid including unintended bias in business term definitions | Definition of standard and shared guidelines to avoid including unintended bias in business term definitions
27,OP16,Validation that business term definitions are free of unintended bias | Capability to validate business terms definitions against defined guidelines to avoid including unintended bias
28,OP17,Periodic examination that business term definitions are free of unintended bias | Implementation of a process that review periodically ethical sensitive business terms definition to ensure that they are still free of unintended bias
29,OP18,Establishment of business term definitions for ethical sensitive data | Definition of standard and shared business terms definition for ethical sensitive data
30,OP19,Approval of defined business term definitions for ethical sensitive data | Capability to review and approve defined business term definitions for ethical sensitive data
31,OP20,"Communication of approved business definitions for ethical sensitive data | Process, responsibilities and tools definition and enforcement for communicating defined defined business term definitions for ethical sensitive data within the appropriate audience"
32,OP1693,Designation of metadata management stakeholders | Designation of stakeholders to be responsible for the appropriate management of metadata within the organization. These stakeholders shall be responsible for the usage of standardized metadata throughout the lifecycle of data elements. The contact information and titles of designated stakeholders should be documented and updated when changes are made to have a clear oversight of metadata management responsibilities.  
33,OP1690,Establishment of data definitions & valid values | 
34,OP1740,"Implementation of metadata repository | Implementation of a metadata repository to have a centralized location to store metadata within the organization. The metadata repository shall ensure the accuracy between business data elements and its many physical implementations. Metadata providers should be encouraged to store metadata in a single, enterprise-wide accessible repository to protect the integrity of the metadata."
35,OP1747,"Establishment of metadata quality control | Establishment of metadata quality control provides a greater confidence in the quality of metadata being consumed and used within the organization. The level of quality control shall vary based on the nature of the metadata's usage and the organization's metadata specifications. Metadata quality controls shall include evaluating the completeness of metadata (whether there is missing or incomplete information about the data element), the accuracy of metadata (whether the values accurately describe the data element) and the consistency of metadata (whether the values are used consistently throughout the worksheet)"
36,OP1694,Implementation of tracking mechanisms for metadata | Implementation of tracking mechanisms for metadata allows the organization to monitor the usage and creation of metadata throughout the organization. Tracking mechanisms should include some automated capabilities to flag moments where metadata usage or quality is not aligned with the organization's specifications for metadata management.
37,OP1954,"Establishment of data catalog | A Data Catalog is a collection of metadata, combined with data management and search tools, that helps analysts and other data users to find the data that they need, serves as an inventory of available data, and provides information to evaluate fitness data for intended uses."
38,OP2059,"Definition of basic metadata to be captured for data elements | The data elements aligned to a data domain must have basic metadata captured including but not limited to source, term name, term definition, field name and field location. The basic metadata is required to make the data accessible. As data is prioritized based on business needs and business process criticality the data policy will require a more comprehensive set of business and technical metadata to be captured."
39,OP2191,"Automation of data catalog capabilities | Automation is essential to efficient and effective maintenance of the data catalog. The data catalog should automatically define, capture, relate and share metadata if it is practical. Examples include:
- Metrics, KPIs and SLAs and data ownership to support data profiling and data quality management
- Classification of data properties to specify sensitivity
- Capture of provenance information, including data origin and footprint to support tracing and authoritative sourcing
- Lifecycle metadata to manage dataset maturity and enable records retention, archival, disposal policy
- Usage metadata to audit access, purpose, sharing and ethical use of data."
40,OP2192,"Establishment of data catalog interoperability | Data catalog interoperability is an important capability in multi-cloud or hybrid-cloud environments. Enabling data catalog interoperability between platforms and applications is achieved by defining structure using:
• Catalog metadata naming standards and a catalog information model for data sets.
• Relationships between data sets.
• Data services.
Establishing these standards and models is essential to integration and consistency when sharing or combining catalogs."
41,OP1966,Monitoring of business metadata capture | The capture of business metadata must be continually monitored to ensure captured metadata fits with the organization's metadata model. This also ensures the quality of metadata.
42,OP160,Definition of metadata scope to be captured during model development | Definition of a metadata model that allows capture of relevant model metadata that explain model decisions during model development phase
43,OP161,Capture of required metadata to explain model decisions | Definition and enforcement of process and responsibilities to capture and document required metadat to explain model decisions
44,OP162,Approval of captured metadata for explainability | Process and responsibilities definition and enforcement to approve captured model metadat for explainability
45,OP163,Definition of metadata model | Design and implemention of an enterprise-wide standard metadata model
46,OP1958,Definition of metadata model for DM initiative | Definition of a data model for the metadata repository to be used by the Data Management initative. Metadata model shall explain the relationships between systems containing metadata as well as detailing the elements and processes of the model. 
47,OP164,Governance of metadata model | Design and implementation of a process that formally governs adoption and maintenace of the metadata model by each data domain.
48,OP165,Monitoring gaps in metadata model usage | Design and implementation of a process that identifies gaps between the enterprise metadata model and metadata specific to each business process within a data domain.
49,OP166,Establishment of capability to resolve metadata model usage issues | Establishment of a metadata model issue resolution capability to resolve metadata model usage gaps and provide continous stakeholder communication
50,OP234,Demonstration that source metadata is available | 
51,OP235,Validation of access to required transformation metadata | 
52,OP236,Extraction of metadata included in AML data lineage | 
53,OP2098,"Analysis of data retention regulatory requirements | A comprehensive overview / analysis of constraining frameworks containing explicit or implied data retention (minimum) and non-retention (maximum) requirements is required to ensure compliance. These frameworks shall include: 
- Legal frameworks in all relevant enterprise jurisdictions (both where the enterprise operates and where the associated parties reside – clients, suppliers, partners, …)
- Regulatory frameworks in all relevant enterprise jurisdictions, prioritizing those that are the object of internal or external audits
- Ethical frameworks in all relevant enterprise jurisdictions"
54,OP2099,"Analysis of data retention business requirements | A comprehensive overview / analysis of data use cases and needs (exploration, retrieval, analytics, enrichment, sharing, ....) is required to identify the data retention and non-retention requirements, if any, stemming from business needs, data protection requirements and corporate practices"
55,OP2100,"Assessment of business needs against regulatory requirements | A risk assessment is required to balance data use needs with data retention constraints (legal, regulatory, ethical, protection). It is recommended to consider the likely evolution of legal, regulatory, ethical, data-use and protection context to not only evalute the present, but to include the near future in the assessment as well. "
56,OP2101,"Establishment of data retention schedules | Data retention schedules are required for the different types of data handled by the organization. They shall set out the minimum and maximum retention periods and shall be defined per data domain (eg., Finance, HR, Passenger Information, Marketing, etc) and may be further detailed, if relevant, by other criteria such as:
- Environment (ex. production, test; secure data room, remote user workstations, mobile devices)
- Use cases (ex. data exploration, analytics, forensics, legal investigation)
- Data access levels (ex. hot, cold / archived)
- Data protection levels (ex. cleartext, de-identified, access-controlled)
- Data storage platforms (ex. data warehouse, analytics application, operational system such as ERP)
- Data structure levels: structured, unstructured, partially structured (ex. database tables, as well as Excel files, Microsoft Office documents, e-mails, social-media content, …) 
- Data digitization levels: electronic and paper documents
- Data infrastructure platforms: on-premise,  cloud; databases, applications, file systems, …
- Data storage platforms: operational systems – ex. ERP, CRM; data warehouses, data lakes, AI/ML models, analytics tools and platforms, reports, applications, metadata platforms (ex. ETL tools, data catalogs) 
- Jurisdictions (legal, geopolitical: ex. corporate branches, residency of customers, operating jurisdictions of business partners, …)"
57,OP2102,"Definition of guidelines for operationalizing retention schedules | Guidelines are required for the interpretation and operationalization of data retention schedules. They shall provide guidance such as when additional retention may be required for legal hold, when data should be purged vs archived and recommendations for supporting technologies"
58,OP2103,"Definition of roles & responsibilities for data retention policy | Clear roles and responsibilities are required to ensure the operationalization of the data retention policy. For each role, the expected technical expertise and data retention knowledge should be documented to help with their assignment. Roles and responsibilities shall be defined and documented, to: 
- Maintain, approve, and socialize the retention policy
- Operationalize (execute) the retention policy
- Oversee the successful application of the retention policy"
59,OP2104,"Definition of success criteria metrics for data retention | Success criteria metrics must be defined along with thresholds quantifying success levels of retention. The metrics shall cover all aspects of data retention operationalization, including:
- Data disposal (Destruction & Archiving)
- Data storage
- All variables based on which retention (storage) and non-retention (disposal) periods are defined in the Policy; these shall include, in particular:
   - Storage levels (ex. hot/cold), when relevant (i.e. when retention periods are defined based on such levels)
   - Data domains and other relevant groupings of data elements, based on which retention periods are defined
   - Data stores, systems, platforms, processes, and any other parameters which serve to determine some (if not all) retention periods"
60,OP2105,"Definition of data retention policy | Initial definition of a corporate Data Retention policy is a foundational activity, which should be planned and performed proactively, as an integral component of risk mitigation, independently of any specific project, technical or corporate-environment triggers. However, an increase in specific risk factors (see below) or the status-quo of ad-hoc, uncoordinated silo-confined (project- or data-specific) retention / non-retention actions (ex. data archiving) significantly increases the urgency of defining or refining a Data Retention policy for the enterprise."
61,OP2106,Approval of data retention policy | 
62,OP2107,"Socialization of data retention policy | The socialization of the approved data retention policy is required for its operationalization. The data retention policy shall be:
- Made available to all interested parties
- Read by all interested parties
- Understood by all interested parties"
63,OP2108,"Assignment of roles & responsibilities for data retention policy | Roles and responsibilities shall be assigned, as documented, to: 
- Maintain, approve, and socialize the retention policy
- Operationalize (execute) the retention policy
- Oversee the successful application of the retention policy"
64,OP2109,Definition of triggers for data retention policy update | 
65,OP2110,"Update of data retention policy | Updating the Data Retention policy is generally triggered by a change to any aspect of the corporate environment that is relevant to data retention and that affects the risk of not implementing said retention, including: 
- Change in the set of applicable legal frameworks relevant to retention (ex. following the acquisition of an international business partner, or expansion of operations to a different jurisdiction, or cessation of operations in a jurisdiction, in which case some previously-relevant legal frameworks no longer apply; alternatively: change in the range of jurisdictions of customers, business partners or other relevant parties, if such change modifies which legal frameworks apply)
- Change in the content of existing applicable legal frameworks relevant to retention (ex. new or modified legal provisions that impact retention) 
- Change in the set or content of applicable, especially audited, regulatory frameworks relevant to retention
- Change in the set of audits, internal or external, relevant to retention
- Change in the set of content of applicable ethical frameworks relevant to retention
- Change in the nature, scope or content of data use scenarios, which impact data collection needs (ex. expansion of AI/ML functionality, processing of new data sets, addition of new analytics tools or use cases) 
- Change in the set of internal or external corporate data that is processed (ex. acquisition of new data sets, sharing of data with new partners)
- Change in data protection requirements, frameworks or risk (the latter triggered, notably, by security breaches)"
66,OP2380,"Analysis of data retention requirements (In the lab and In the field) | Analysis of data use cases and needs (exploration, retrieval, analytics, enrichment, sharing, ....) regarding the data retention and non-retention requirements, if any, stemming from business needs, data protection requirements and corporate practices"
67,OP2111,Assessment of current state of data retention | 
68,OP2112,"Analysis of gaps between current state and data retention policy | Capability to identify and document the gaps between the organization's current state (in terms of data retention processes, standards, policies, technology, resources) and the target state set out by the defined data retention policy. This gap analysis shall strongly influence the prioritization of data retention implementation activities."
69,OP2113,"Establishment of prioritization criteria for data retention | Creation of template / guidelines for assigning priorities to combinations of retention-policy implementation activities, data elements, and, optionally, systems/processes "
70,OP2114,"Prioritization of data retention policy implementation activities | Creation of a prioritized list of data retention activities and data elements as well as, optionally, systems/processes to which those activities shall be applied"
71,OP2115,Establishment of roadmap for data retention policy implementation | Creation of a roadmap laying out the incremental implementation of the data retention policy through a set of activities and controls. The roadmap shall include the major steps and milestones needed to go from the current state to the target state laid out by the retention policy.
72,OP2116,"Identification of dependencies for data in retention scope | Capability to identify and document for the set of data elements to be retained or disposed (henceforth designed as Target Data):
- Data dependent on target data: Dependant data will generally need to be disposed along with the target data in order to maintain data consistency (ex. to avoid data referring to other data which no longer exists. The two main categories of dependent data are data which refers to the target data (eg. parent-child relationships) and data which is derived from the target data (chain of derivations from target data)
- Data on which the target data depends: Such data may be retained or not, along with the target data, depending on the terms of the retention policy for target data"
73,OP2199,"Creation of a data retention plan for project data (In the Lab and In the field) | Establishing and creating a project data retention management plan for data ""In the Lab"" and ""In the field"", as per the context of the project"
74,OP2202,"Review and approval of project's data retention management plan | Reviewing, validating and approving the project's established data retention management plan"
75,OP2117,"Creation of timestamps for data retention | Establishing and creating timestamps for data covered by data retention schedule, as per the context of the project"
76,OP2118,"Definition of retention monitoring framework | A retention monitoring framework must be defined and aligned with the success criteria metrics defined. The framework shall be centered on: 
- Measuring actual retention periods (essentially, resulting from data disposal operations – destruction and archiving)
- Comparing actual retention periods with those prescribed in the Data Retention Policy
- Identifying and reporting deviations between actual and prescribed retention"
