,New Code,OPs
458,OP1901,"Validation of data quality against requirements | Ability to trace and evaluate the extent to which the requirements have been satisfied through the data quality management process. When requirements are satisfied, there must be evidence that data quality results reflect the needs and expectations collected from business stakeholders."
459,OP1621,Demonstration of data suitability for model | 
460,OP357,"Assessment of metadata quality | Metadata quality must be managed through the data lifecycle in the same way as the quality of other data. This includes assessing the quality of metadata to ensure consistency, currency and security."
461,OP358,Establishment of committees required to assess quality of training dataset | 
462,OP359,"Assessment of training dataset quality | The dataset used in training the model is evaluated against the established DQ requirements, and its quality assessed accordingly"
463,OP360,"Periodic review & update of training dataset | Datasets are periodically reviewed and updated to ensure their accuracy, quality, currency, relevance and reliability"
464,OP2483,"Definition of guidelines and procedures to determine and specify pipeline quality decision control points | Definition of guidelines and procedures for the creation and establishment of control points, pertaining to pipeline quality decisions, appropriate to the context of the project"
465,OP2484,Validation of pipeline quality decision control points | Review and validation of the defined pipeline quality decision control points
466,OP2485,Implementation of pipeline quality decision control points | Implementation and monitoring of the validated pipeline quality decision control points
467,OP2486,Establishment of processes to address and resolve deviations in pipeline quality | Definition and establishing processes to address and resolve issues relating to pipeline quality deviation/degradation
468,OP2479,Definition of quality requirements and criteria for the pipeline | Define and establish the requirements for various quality criteria of the model development pipeline
469,OP2480,Definition of Pipeline Quality Indicators | Identification and definition of the various pipeline quality metrics as well as their respective goals and/or thresholds
470,OP2481,Definition of pipeline quality decision control points | Definition of pipeline quality decision control points appropriate to the context of the project
471,OP2482,Validation and approval of Pipeline Quality Indicators | The proposed Pipeline Quality Indicators are reviewed and their appropriateness and completeness is validated and approved
472,OP2487,Documentation of pipeline quality evaluation | Recording and documenting the results of the pipeline’s quality evaluation
473,OP2488,Creation of an escalation process for pipeline quality deviations | Creating and establishing a pipeline quality deviations escalation process to inform the respective responsible stakeholders of such issues
474,OP2489,Definition of processes for conducting root-cause analysis of pipeline quality | Establishing processes and guidelines for investigating and understanding the root-causes and reasons of anomalous and uncharacteristic pipeline quality
475,OP2490,Documentation and communication of the root-cause affecting the pipeline quality | Documenting the root-causes and their effect on the quality of the pipeline as well as communicating the findings to relevant stakeholders
476,OP2491,Periodic audit of pipeline quality decision control points | Pipeline quality decision control points are periodically audited to insure proper implementation and enforcement of the control points
477,OP2492,Implementation of pipeline quality monitoring | Implement the established piepline quality indicators: data collection is established and periodic assessment of the indicators is performed
478,OP2493,Documentation of pipeline quality assessments | Recording and documenting the outcomes of pipeline quality assessments
479,OP2494,Validation of the produced pipeline quality artefacts | Review and validate the produced pipeline quality artefacts
480,OP2495,"Assessment of Pipeline Quality Monitoring operating practices | Review and assess the PQM function, to ensure proper implementation and functioning"
481,OP2162,Definition of data specifications and work instructions | The purpose of Provision of Data Specifications and Work Instructions is to establish the basis on which to perform Data Processing and Data Quality Monitoring and Control. Work instructions for Data Quality Monitoring and Control include methods to measure data nonconformities and process performance. 
482,OP2163,"Execution of Data Processing | Capability to create, use, update and delete data in accordance with data specifications and work instructions. Execution of Data Processing is improved by educating end users in the application of the specifications and work instructions. When data is processed by software applications, embed the specifications and work instructions within this software.
NOTE: Data Processing is an integral part of business processes, being performed by end users across the organization. Therefore, when applying Data Processing within any part of an organization, the approach is specific to the business processes of that part of the organization."
483,OP369,"Definition of formatting and cleansing requirements for operational inputs | The data formatting and cleansing requirements, as per the context of the project and model, are established and defined"
484,OP370,Definition of guidelines and procedures for cleansing data | 
485,OP1579,Definition of reference data for cleansing context | 
486,OP371,Formatting and cleansing of data (Training dataset input) | 
487,OP2403,Design and implementation of data formatting and cleansing processes (Operational inputs) | Design and implementation of formatting and cleansing processes for the data that feeds the model in operation (in the field)
488,OP2164,"Logging of Data Processing activities | Capabilty to create and store records of people or software applications, data processing time stamp and a history of data modifications and transfers to help in tracing the root causes of data nonconformities. Data logging should take place to a degree that is appropriate to the benefit achieved for the associated processing cost. Organization should consult with legal counsel as legal restrictions can apply to data logging activities depending on the type of data being processed."
489,OP372,Definition of data entry quality controls | Data entry input controls are preventive controls that should be implemented in systems that collect data across various business processes within the organization. Data entry input controls help maintain high integrity and quality of the data entered into the system so that processes can be executed properly. 
490,OP2322,"Establishment of processes and guidelines to define and implement DQ control points | Definition of guidelines, procedures and/or processes to determine and implement adequate data quality control points"
491,OP2323,Implementation of DQ controls at entry points into the AI system | Implementation of adequate data quality control points at data entry points to the AI system to monitor the quality of the data before it is utilized by the system
492,OP373,"Implementation of quality controls to prevent data entry errors | Data entry input controls must be implemented to prevent invalid data from entering the systems and to enforce data quality business rules. For example, a business rule that all province code fields must comply with the CDN Province Abbreviations can be enforced by data entry pick lists and data integration lookups. 
If a data entry interface does not have edits or controls to prevent incorrect data from being put in the system data processors are likely to take shortcuts, such as skipping non-mandatory fields and failing to update defaulted fields. "
493,OP374,Definition of procedures for the management of data quality issues | Data quality issues should be addressed systemically and at their root causes to minimize the costs and risks of corrective actions. 'Solve the problem where it happens' is the best practice in Data Quality Management. This generally means that corrective actions should include preventing recurrence of the causes of the quality problems.
494,OP375,Definition of procedures for the management of a DQ issues repository | Definition and enforcement of a process and R&R to manage the DQ issues repository
495,OP376,Definition of procedures to assess impacts of data quality issues | Development and implementation of a standard methodology for business functions to assess the impacts of poor data quality on their processes/operations in a quantifiable manner.  
496,OP377,Definition of procedures to assess root causes of data quality issues | Development end implementation of a standard methodology for business functions to assess the root causes of poor data quality.
497,OP378,"Establishment of data quality resolution procedures and processes | Defining and establishing data quality issue resolution  procedures and processes encompassing issue identification, tracking and resolution through root-cause analysis"
498,OP379,Establishment of a data quality issues repository | Implementation of tools to support the data quality issues resolution process
499,OP380,Establishment of a capability for tracking and documenting data quality issues | Establishment of a DQ issue management capability to track DQ issues (incl. DQ controls deficiencies) to resolution and provide continous stakeholder communication
500,OP381,Recording of data quality issues in DQ issue repository | Capability to record data quality issues in repository following their identification. The recording of data quality issues must include appropriate metadata to support the remediation process.
501,OP2405,Documentation and management of data quality issues | Capability to record data quality issues 
502,OP382,"Review and approval of data issues logged into repository | Capability to review, prioritize and approve Data quality issues to resolve"
503,OP383,"Categorization of data issues logged in repository | Capability to categorize data issues logged in repository based on resolution progress, urgency to resolve issue, possible impact of data issue, and other relevant criteria. Data quality issues should also be categorized by the issue type (e.g., duplicate data, inaccurate data, ambiguous data, inconsistent data, etc.) to support the resolution process."
504,OP384,Monitoring of data issues logged in repository | 
505,OP385,Notification of data issues to the relevant data stakeholders | Establishing a communication channel with data producers and informing them of any issues to be resolved with respect to the quality of the data they are producing
506,OP386,Periodical re-assessment of impacts of data quality issues | Development and implementation of a standard tool for business functions to support the impacts of poor data quality assessment process.
507,OP387,Assessment and documentation of potential impacts of data issues on model building | Capability to assess the potential impacts of data issues on model building. This assessment should support the establishment of DQ requirements and thresholds.
508,OP388,Assessment and documentation of potential impacts of data issues on models in production | Capability to assess the potential impacts of data issues on models in production. This assessment should support the establishment of DQ requirements and thresholds.
509,OP390,"Monitoring of impacts of data quality issues | Design and implementation of processes that will measure costs and consequences of failing to proactively assess impacts of possible data quality issues. 
Establishment of a process whereby an independent (of the business) assessment is conducted periodically and reported to Sr. management and the Board."
510,OP391,Attestation that data issue impacts have been assessed | 
511,OP392,Assessment and documentation of root causes of data quality issues | Definition and enforcement of a process for assessing the root causes of data quality issues that considers both people and technology that interact with data flows between source capture and consuming application
512,OP394,Reporting of data quality root causes | Establishment of a reporting structure to ensure that upstream systems are aware of repetitive or continuing data quality problems. 
513,OP395,"Definition of roles & responsibilities specific to resolution of data quality issues | Establishment of a DQ issue management matrix that defines those parties Responsible, Accountable, Consulted and Informed on DQ issues incl. DQ controls deficiencies. "
514,OP396,"Prioritization of data issues to be resolved (Enterprise) | Capability to review, prioritize and approve Data quality issues to resolve"
515,OP2197,"Prioritization of data issues to be resolved | Capability to review, prioritize and approve Data quality issues to resolve"
516,OP1623,Tracking of quality issues in model development data | 
517,OP397,Assignment of data quality issues for analysis & resolution | Data quality issues are assigned to specific personnel for additional analysis and resolution
518,OP398,Definition of SLA for data quality issues resolution | Definition of Service Level Agreements between stakeholders based on data quality issues type and criticality for acknowledging and resolving data quality issues
519,OP2025,Definition of data quality remediation plan | 
520,OP399,"Resolution of data quality issues impacting a project | The data quality issue resolution process encompasses issue identification, tracking and the resolution of issues through root-cause analysis. The issues involved can be data quality (DQ)-related, process quality (PQ)-related, or technology-related."
521,OP400,"Reporting of data issues resolution | Definition and establishment of a stakeholder communication plan that provides timely and accurate updates to the group(s) consuming the data (Notification of data issue logging in repository, Communication during data issue resolution, Notification of data issue resolution)"
522,OP401,"Attestation that data quality issues have been resolved | Definition and enforcement of a process to monitor that data quality issues have been effectively identified, tracked and resolved."
523,OP2582,Definition of operational data quality metrics and controls | The development of data quality metrics is a critical component to inform data consumers about quality characteristics that are important to their uses of data.
524,OP2583,Design and implementation of data quality metrics and controls | The development of data quality metrics is a critical component to inform data consumers about quality characteristics that are important to their uses of data.
525,OP402,Definition of required data quality metrics | The development of data quality metrics is a critical component to inform data consumers about quality characteristics that are important to their uses of data.
526,OP2300,"Definition of model data quality metrics | Define necessary data quality metrics for: 
- Data used for Model Building/Testing
- Data used for Model Training/Testing datasets
- Data used for Model Validation
- Data used by Model in Production"
527,OP2305,"Validation of model data quality metrics | Validate data quality metrics defined for: 
- Data used for Model Building/Testing
- Data used for Model Training/Testing datasets
- Data used for Model Validation
- Data used by Model in Production"
528,OP403,Definition of thresholds for each data quality metric | Definition of thresholds that are exceptable and unacceptable for data quality based on material impact to business objectives
529,OP404,Approval of data quality metrics and thresholds | Process and responsibilities definition and enforcement for data quality metrics & thresholds approval
530,OP406,"Definition of processes to communicate data quality metrics and thresholds  | Process, responsibilities and tools definition and enforcement for communicating data quality metrics & thresholds approval across the organization"
531,OP407,"Development of a business case justifying data quality controls | Developing the business case to provide the rationale behind implementing data quality controls, including the business value, risks, cost-benefit analysis, accountabilities, etc."
532,OP408,Definition and design of required data quality controls | Documentation of the data flow from capture process to consuming business application and determination at which points data quality should be measured. 
533,OP409,Review and approval of data quality control design | Capability to review and approve Data quality control points design specifications
534,OP410,Communication of DQ controls to relevant stakeholders | Data quality controls are socialized and communication to relevant stakeholders
535,OP411,Implementation of data quality controls in source systems | Definition and enforcement of a process and R&R to manage the DQ controls implementation (in processes or systems)
536,OP412,Attestation that data quality controls have been built and deployed | Definition and enforcement of a process to monitor that data quality controls have been effectively built and deployed
537,OP413,Establishment of a data quality controls repository | Establishment of a uniform and shared data quality controls repository
538,OP2307,Establishment of data quality rubrics | Definition of data quality rubrics that guide the analysis of data quality evaluation and interpretation of the results
539,OP414,Definition of guidelines and procedures to manage a data quality control repository | Definition and enforcement of a process and R&R to manage the DQ controls repository
540,OP415,Definition of guidelines and procedures to monitor data quality  | Establish a capability to make sure that the data quality controls are periodically auditable. DQ controls auditing should occur on three levels - (A) Quality Assurance by the business. (B) Quality Control by the CDO office to enforce business to remediate any gaps. (C) 2nd line of defense. 
541,OP416,Definition of escalation procedures for poor data quality | 
542,OP417,"Operational monitoring of DQ controls | Design and implementation of processes that will measure costs and consequences of DQ controls deficiencies to proactively assess impacts on data quality for models.
Establishment of a process whereby an independent (of the business) assessment is conducted periodically and reported."
543,OP418,Operational monitoring of DQ metrics | 
544,OP419,Operational monitoring of DQ issues management | 
545,OP420,Operational monitoring of data transformation processes | Capability to continually monitor data transformation processes to ensure conformity with pre-defined rules. It is important to validate that transformation processes convert data in the correct fit-for-use format.
546,OP421,Periodic review of DQ assessment efficiency | 
547,OP2201,Periodic review of data quality issues register | Reviewing in a regular manner data quality issues logged in the register
548,OP422,Periodic review of DQ metrics & controls  | Development end implementation of a standard methodology for business functions to assess the efficiency of the DQ controls in place in a quantifiable manner.  
549,OP423,Evaluation of data quality controls' efficiency | Definition and enforcement of a process to monitor that data quality controls have been effectively assessed.
550,OP1580,Monitoring of Data quality integrity | 
551,OP424,Production of enterprise data quality dashboards | 
552,OP425,Production of periodic data quality dashboards (in context) | Data quality dashboards are developed to meet stakeholders' information needs
553,OP426,Execution of data quality reports for all enterprise data | 
554,OP427,Execution of data quality reports for specific name screening business rule | 
555,OP428,Execution of quality reports on specific customer data business rules | 
556,OP429,Execution of data quality reports for the TM & F Programs | 
557,OP2055,Attestation that current data quality levels meet the data quality requirements | Establishing the ability to formally certify that the current data quality level meets the data quality requirements
558,OP1748,Definition of roles & responsibilities for reference data management | 
559,OP1749,Documentation of existing valid values | 
560,OP1750,Establishment of rules for new reference data values | 
561,OP1751,Assessment of proposed new value to reference data | 
562,OP1752,Documentation of new value addition to reference data | 
563,OP1753,Detection of unauthorized use of new reference data | 
564,OP1754,Harmonization of reference data values across systems  | 
565,OP430,Definition of guidelines and procedures for the creation of master data | …
566,OP431,Definition of master data management processes | …
567,OP432,Enterprise standards for the definition of unique identifiers for master data | …
568,OP1757,Establishment of standardized values across the organization | 
569,OP1758,Establishment of external sources for data enrichment | 
570,OP1760,Establishment of a protocol to manage exceptions in the Master Data | 
571,OP1755,Establishment of identity resolution process | 
572,OP433,Resolution of master data duplicates (In the field - Operational Inputs) | Mitigating and resolving duplicates (deduplication) of Master Data (in the field)
573,OP2404,Resolution of master data duplicates (In the lab) | Mitigating and resolving duplicates (deduplication) of Master Data (in the lab)
574,OP1576,Definition of matching process within Master data | 
575,OP1577,Definition of survivorship process within Master Data | 
576,OP1578,Documentation of created data within master data | 
577,OP1756,Monitoring of Master data management | 
578,OP2133,Definition of golden copy sensitivity to false positive/negative | 
579,OP2134,"Identification of master data identifying attributes | To figure out the identifying attributes, Business Data Stewards need to establish the minimum set of high-quality potential identifying attributes that exist across the source systems, then evaluate those attributes to see if the identified attributes can serve the purpose."
580,OP2135,Mapping of unique identifiers to physical data | 
581,OP2137,Analysis of potential identifying attributes | 
582,OP2138,"Standardization & cleansing of data  | Standardize, parse and cleanse data to arrive at:
- ""best match"" record set
- Set of identifying attributes
- Understanding of data quality issues"
583,OP2139,Compilation of recordset from source systems | 
584,OP2140,Enrichment of records with reliable external sources | 
585,OP2141,"Creation of ""golden copy"" for master data records | "
586,OP2142,Review and approval of golden copy results | 
587,OP2143,Establishment of mechanism to monitor usage of golden copy | 
588,OP1759,Establishment of survivorship business rules | 
589,OP2144,Identification of sources for master data attributes | 
590,OP2145,Assignation of source priorities and conditions | 
591,OP2146,Identification of master records with conflicting attribute values | 
592,OP2147,Application of attribute value conflict resolution rules | 
593,OP2148,Resolution to master record with specified attribute values | 
594,OP2149,Establishment of mechanism to detect & report MDM exceptions | 
595,OP2150,Analysis of root-cause of MDM exception | 
596,OP2151,Resolution of master data exception | 
597,OP2152,Update of MDM data processing documentation | 
598,OP2153,Update of MDM/DQ exception rules | 
599,OP255,Identification / Definition of authoritative data sources for Master data | 
600,OP1571,Identification / Definition of authoritative data sources for Reference data | 
601,OP1572,Identification / Definition of authoritative data sources for Transactional data | 
602,OP1573,Communication of authoritative data sources to relevant Stakeholders | 
603,OP2361,Attestation (with evidence) that authoritative data sources are being used | 
604,OP193,Assessment of data source prior to usage | Capability to assess data sources prior to usage to ensure that they represent fair data sources
605,OP434,Definition of privacy vision and mission statement | 
606,OP435,Definition of enterprise privacy principles and standards | 
607,OP436,"Definition of a privacy policy | A privacy policy is a statement or legal document (in privacy law) that discloses some or all of the ways a party gathers, uses, discloses, and manages a customer or client's data. The exact contents of a certain privacy policy will depend upon the applicable law and may need to address requirements across geographical boundaries and legal jurisdictions. Most countries have their own legislation and guidelines of who is covered, what information can be collected, and what it can be used for. In general, data protection laws in Europe cover the private sector, as well as the public sector."
608,OP437,"Definition of enterprise  codes of conduct to protect privacy | A code of conduct, also known as privacy and code of conduct, is a defined set of rules, principles, values, employee expectations, behaviours, and relationships that a business considers important and believes necessary for its success. Codes of conduct must be distributed to all employees to ensure awareness of the organization's privacy principles."
609,OP438,"Definition of privacy requirements for external contractors, vendors and service providers | "
610,OP439,Approval of enterprise privacy policies and procedures  | 
611,OP440,Communication of enterprise privacy policies | 
